{
  "$schema": "https://json-schema.org/draft/2020-12/schema",
  "$id": "polylogue.external-agent-campaign.v1",
  "type": "object",
  "required": ["schema_version", "campaign_id", "workload_id", "prompt_profile", "prompt_contract", "jobs"],
  "properties": {
    "schema_version": {"const": 1},
    "campaign_id": {"type": "string", "minLength": 1},
    "workload_id": {"type": "string", "pattern": "^[a-z0-9][a-z0-9-]*$"},
    "prompt_profile": {"type": "string", "minLength": 1},
    "prompt_contract": {"type": "string", "minLength": 1},
    "result_kind": {"enum": ["package", "conversation_markdown"]},
    "snapshot_gate": {"type": "string"},
    "jobs": {
      "type": "array",
      "items": {
        "type": "object",
        "required": ["id", "slug", "title", "brief", "prompt", "result_prefix", "depends_on"],
        "properties": {
          "id": {"type": "string", "pattern": "^[a-z0-9-]+-[0-9]{2}$"},
          "slug": {"type": "string", "pattern": "^[a-z0-9][a-z0-9-]*$"},
          "title": {"type": "string", "minLength": 1},
          "brief": {"type": "string", "pattern": "^briefs/[0-9]{2}-.*\\.md$"},
          "prompt": {"type": "string", "pattern": "^prompts/[0-9]{2}-.*\\.md$"},
          "result_prefix": {"type": "string", "pattern": "^[a-z0-9][a-z0-9-]*$"},
          "depends_on": {"type": "array", "items": {"type": "string"}}
        },
        "additionalProperties": false
      }
    }
  },
  "additionalProperties": false
}
